text_id,text,task_1,task_2,task_3
hasoc_en_3207,"Who gets the #dickhead 🦆😏( Can't find emoj)iof the week award? Me, of course..for agreeing to do @BigRomanceBar @dublinrecordclub show next Wed when I'm not even here. Sorry #graham Smith for messing you about. We'll sort out another date, if you haven't lost patience already.",NOT,NONE,NONE
hasoc_en_268,"Now we can add #FlagRapist to the resume of #Traitor, #Pedophile, #Racist, #Rapist and serial sexual predator of women @RealDonaldtRump! https://t.co/2nBGNxGIsi via @HuffPostPol #MeToo",HOF,OFFN,TIN
hasoc_en_3940,What is stopping Modi Govt To Impose president Rule In West Bengal #doctorsfightback @MamataOfficial #MamataBanarjee @AmitShah,NOT,NONE,NONE
hasoc_en_2370,Change host uk to India know @ICC   #ShameOnICC,NOT,NONE,NONE
hasoc_en_1473,Evening Retweet Party!! 🥳🥳🥳     For @CajunBlueAZ1 come on #resisters let’s show her some love 💙❤️💙❤️  #ResistTogether   #fucktrump  #DumpTrump2020   #Unite2020   #VoteBlueNoMatterWho     It's simple     Just follow all who :    Like :    Retweets :    Comment :,NOT,NONE,NONE
hasoc_en_3468,Who's going to win today??  🇮🇳vs🇦🇺 #INDvAUS #INDvsAUS #CWC19 #cwc2019 #TeamIndia #CmonAussie  @BCCI @CricketAus #SundayThoughts #CricketWorldCup2019 #CricketMeriJaan #DhoniKeepsTheGlove #dhonigloves #ViratKohli #AaronFinch,NOT,NONE,NONE
hasoc_en_1472,"According to The Times and the Daily Mail, Brussels believe that whoever wins the Conservative leadership race will agree to an extension to the UK’s departure from the EU..  https://t.co/Y4JFZcXprQ    #BorisJohnsonShouldNotBePM   #BollocksToBoris   #BollockstoBrexit https://t.co/Lg1MksA2eG",NOT,NONE,NONE
hasoc_en_1913,"If #Boris Johnson were applying for a regular job, he would no doubt have to supply a reference from a previous employer.    Max Hastings employed him for longer than anyone else and, as it happens...    #bbcpm #BorisJohnson #BorisJohnsonShouldNotBePM https://t.co/VicDhQlI9T https://t.co/SsRKNXW8zn",NOT,NONE,NONE
hasoc_en_2145,@AjayKushwaha_ @realDonaldTrump PRESIDENTIAL HARASSMENT:   @realDonaldTrump asking @BarackObama for his birth certificate for YEARS !!! while hiding his own #taxreturns     #Resistance #LockThemAllUp #FuckTrump #ComplicitGOP #Resist      https://t.co/lF2am3njsh,NOT,NONE,NONE
hasoc_en_694,I bought like 10 things from this store just bc of the shirt alone 👌🏻 #fucktrump https://t.co/Zhwhp0LLcb,NOT,NONE,NONE
hasoc_en_5834,@polisands @GOP @realDonaldTrump I’m sorry you are so I’ll-informed! It is a crime to take foreign government’s help in order to influence an election and YOUR president said he’d commit that crime to get re-elected!! #SAD #TrumpIsATraitor,HOF,HATE,TIN
hasoc_en_2399,Traitor piece of shit mother fucker. #FuckTrump #TraitorTrump #ImpeachTheMFTraitor,HOF,PRFN,TIN
hasoc_en_644,"You get one for his front, I'll buy one for his back.",NOT,NONE,NONE
hasoc_en_5410,"@funder I wonder if his cult/followers are going to watch it since it's not on their only news station,  fox. #TrumpIsATraitor #TrumpRussia #TrumpsAnInternationalDisgrace",HOF,HATE,TIN
hasoc_en_4033,"@BCCI Wts the stupid logic of sharing a point each by the teams which could not play match due to rain...? Stupendously idiotic. it is unfair @ICC  change ur rules ,get reserved days to play matches which couldn't have played due to rain .it only helps the fortunate!#ShameOnICC",HOF,PRFN,TIN
hasoc_en_817,WaPo: NRA paid thousands to board members for services #Resist #ResistTrump #FuckTrump https://t.co/uVLLjGZprD,NOT,NONE,NONE
hasoc_en_1791,I must ask #Dhoni to withdraw from @ICC  world cup. Why @adgpi allowed #dhoni to wear insignia during a cricket match. Do Indian Army need such a cheap trick ?  #DhoniKeepTheGlove #DhoniKeepsTheGlove,NOT,NONE,NONE
hasoc_en_2136,Have we failed our Doctors? https://t.co/4OTEkcOB7A via @wordpressdotcom   #DoctorsFightBack #DoctorStrike #WestBengal,NOT,NONE,NONE
hasoc_en_808,जानिए आखिर क्यों इकट्ठा करते हैं एम.एस धोनी स्टंप     #dhoni #ipl #csk #cricket #msdhoni #viratkohli #msd #rcb #rohitsharma #mahi #kohli #india #virat #teamindia #indiancricket #love   #cricketer #icc #indiancricketteam,NOT,NONE,NONE
hasoc_en_284,Name calling works!!!  #DotardDonald #LiarTrump #DerangedDonald #BullyTrump #DesperateDonald #IdiotTrump but you’ve got to tell the truth or it doesn’t. @SpeakerPelosi isn’t nervous. You are. It’s called #Projection and Donny? It’s okay. You’re right to be nervous. #FuckTrump https://t.co/Wp9oKbYFAh,NOT,NONE,NONE
hasoc_en_941,How many Muslim retweeted your post or atleast liked it... Self proclamations is little harmful. But then u being who you are.. I shall rest my case..,NOT,NONE,NONE
hasoc_en_5220,"@AyethatMe @Imamofpeace @realDonaldTrump He is dubbed the Fake #Imam, and is linked to the extremist #antiMuslim group the Middle East Forum. @tellmamauk @uaf @FahAunty @NYCAntifa @LadsLasses @uaf @zelo_street @TheFabledAesop @Otto_English @witchofpeace @oldwolf1887 @i400s @Resisting_Hate_ @hopenothate @mistamarmite",NOT,NONE,NONE
hasoc_en1_5650,#WATCH 87 year old Charulata Patel who was seen cheering for India in the stands during #BANvIND match: India will win the world cup. I pray to Lord Ganesha that India wins. I bless the team always. #CWC19,NOT,NONE,NONE
hasoc_en_2178,We stand with @msdhoni infact #indiastandswithdhoni  #DhoniKeepsTheGlove https://t.co/pOVVKZK7wy,NOT,NONE,NONE
hasoc_en_193,If u r living today it's bcoz of doctors.. #Savethedoctors #DoctorsFightBack #MamataLosingControl @MamataOfficial .... https://t.co/Wf0F0WLBM8,NOT,NONE,NONE
hasoc_en_1448,"#DhoniKeepsTheGlove Dear Dhoni, If at all under pressure you have change ur keeping gloves request u to have a temprary body Tatoo done on ur Neck with Balidan badge....",NOT,NONE,NONE
hasoc_en_2575,"Aren't we overdoing this sense of Pride, Nationalism bit on #DhoniKeepsTheGlove. There are clear #ICC rules about logos etc. it's important to follow the rules rather than  flex muscles. We are playing the world cup not doing a military ops.",NOT,NONE,NONE
hasoc_en_422,@Comey I am crushed that no one is calling attention to the lie that @hogangidley45 told about #JamesComey being a convict!!!  See the short clip to confirm that #Trump Administration is lying.  #TrumpIsATraitor #TrumpResign #TrumpTantrum #WhiteHouse https://t.co/BNpZLCBQpE,HOF,HATE,TIN
hasoc_en_502,Straight to the point! 🤣🤣🤣🤣  #democrat #democrats #voteblue #fucktrump #bluewave #hatersgonnahate #democrats #demswin2020 #demslifestyle #michelle46 #michelle2020 #demsmakeamericagreat #dmag #lockuptrump #lut #obama… https://t.co/gqEjbphWtZ,NOT,NONE,NONE
hasoc_en_422,T W E N T Y   T H O U S A N D  M O R E   P O L I C E.    Let Boris know where you'd like to see more - http://conservatives.com/morepolice      Like if you want more officers on the streets. ,NOT,NONE,NONE
hasoc_en_289,"Dear @msdhoni , it’s the time not to become attention seeker .Why the Balidan Badge during the crucial tournament ? You have the designation in the Indian army so much time before ... just forget the politics of #DhoniKeepsTheGlove  between ICC and BCCI. Assist @imVkohli in game.",NOT,NONE,NONE
hasoc_en_5538,"@SenSchumer I'd like to think we are better than this, but we elected a racist criminal, so maybe some of us are not. #DerangedDonald #TrumpisaTraitor #TrumpHatesAmerica #TrumpisRacist",NOT,NONE,NONE
hasoc_en_4538,To watch the video https://t.co/wmQWH64k3Q  #rapevictim #victim #rapist https://t.co/aRvxsKaewV,HOF,HATE,UNT
hasoc_en_2472,E. Jean Carroll responds to Trump saying she's 'not his type'\n\n,NOT,NONE,NONE
hasoc_en_5649,4 people I follow have followed OJ Simpson. You know who you are. #Murderer https://t.co/jG9neulzqa,HOF,HATE,TIN
hasoc_en_392,"These days, people from other parties join BJP and suddenly attain eminent status.. What a sad state of affairs..",NOT,NONE,NONE
hasoc_en_3733,Because he is Worthy😇  #IndiaStandsWithDhoni #DhoniKeepsTheGlove https://t.co/sJVLDVfbxa,NOT,NONE,NONE
hasoc_en_171,@gainedgod Ex army men &amp; Tory MPs Rory Stewart &amp; Tobias Ellewood shudder at the thought of Boris as Pm in the year of the 75th anniversary of Dday. I wonder why! #whereswally #boris #BorisJohnsonShouldNotBePM #cowardsfollowcowards #absentfathers https://t.co/SqsLMyRO9O,NOT,NONE,NONE
hasoc_en_4673,@RepMattGaetz @realDonaldTrump #HappyJohnMcCainDay  🙌🏻🙌🏻💙💙🙌🏻💙🙌🏻🙌🏻🙌🏻     @RepMattGaetz  is a DRUNK AND   #TrumpIsATraitor,HOF,HATE,TIN
hasoc_en_2583,#ShameOnICC please at least plan future matches by considering weather...,NOT,NONE,NONE
hasoc_en_3544,"@realDonaldTrump You get dumber by the minute, it’s flabbergasting #IdiotInChief #UnfitToBePresident #UnfitForEverything #FuckTrump https://t.co/t1Qy18fbYS",HOF,OFFN,TIN
hasoc_en_758,"Right #dickhead, free seats one over, feel free to move #personalspace",NOT,NONE,NONE
hasoc_en_3746,BJP MP Ananth Kumar Hegde caught on camera beating up doctor at Karnataka hospital   https://t.co/OhxJqT5N0w  #Savethedoctors   #DoctorsProtest   #DoctorsFightBack   #DoctorsStrike,NOT,NONE,NONE
hasoc_en_1304,Just tried writing a tweet in the search bar🤦‍♂️ #dickhead #toohigh,NOT,NONE,NONE
hasoc_en1_3322,"BREAKING: #Bengals Malda turns sensitive. Kaliachak area that saw a full blown riot in 2016 turns violent after a Muslim youth was allegedly beaten to death on suspicion of theft. Now, shops of Hindus and a Hindu woman are allegedly attacked.",NOT,NONE,NONE
hasoc_en_509,This #Pesach put #Shoelaces on the #Seder plate as a reminder of #refugees & #asylumseekers in flight from war and persecution. #RefugeesAreWelcome ⁦@BHPS2011⁩ ⁦@LiberalJudaism⁩ ⁦@JCOREUK⁩ ⁦@safepassageuk⁩ ⁦@AlfDubs⁩ ⁦⁦@tikkunonline⁩,NOT,NONE,NONE
hasoc_en_5643,He won't leave = LOCK HIM UP! LOCK HIM UP! LOCK HIM UP!  LOCK HIM UP! LOCK HIM UP! LOCK HIM UP!  LOCK HIM UP! LOCK HIM UP! LOCK HIM UP!  LOCK HIM UP! LOCK HIM UP!  #DumpTrump #DumpTrump2020 #TrumpIsATraitor #TrumpIsACriminal #TrumpInJail2020 https://t.co/NjUz2bhAzy,HOF,HATE,TIN
hasoc_en_2645,@Ish_Bhandari Who will make #congressmuktbharat first ?,NOT,NONE,NONE
hasoc_en_916,AIIMS Delhi doctor continues protest against Bengal violence wearing helmet in viral photo https://t.co/CbMlxmCv9f  #BengalBurning #DoctorsFightBack #SaveBengal #Savethedoctors,NOT,NONE,NONE
hasoc_en_4455,#India #AntiMuslim Hate speech https://t.co/GFJYe2nKFW,HOF,HATE,UNT
hasoc_en_3024,"The doctors of India(WB) are not asking something out of the world. Safety, it's a basic right of an individual. Moreover, our doctors are renowned all over the world. So what message are you sending?? We stand with our saviours in the hour of  need. #DoctorsFightBack",NOT,NONE,NONE
hasoc_en_1075,#ICC ...look at pak team...wht is going on.....nw this is appropriate...???boycott icc ...  #DhoniKeepsTheGlove https://t.co/FFbXAKDbF9,NOT,NONE,NONE
hasoc_en_2528,Didt he do well #BorisJohnsonShouldNotBePM https://t.co/YzmmKnLSmL,NOT,NONE,NONE
hasoc_en_1872,"Dear @INCIndia, plz start sending ur spokesperson to news channels.. These channels have nthng to do but discuss #DhoniKeepsTheGlove agenda for a whole day!! It’s torturous.. I’d rather njoy congress getting roasted 😁",NOT,NONE,NONE
hasoc_en_3759,"When #INDvsPAK played last #OneBillion people watched. If it rains on Sunday, it's gonna be a huge loss to @ICC (financially).    What a poor planning @cricketworldcup!!! #CWC19 #ICCWorldCup2019 #ShameOnICC https://t.co/xswwoqGrst",NOT,NONE,NONE
hasoc_en_396,Cancelled a Zomato order as the rider's name was Modi.  His status showed:  Na khaoonga na khaney doonga!    #Zamato #IStandWithZomato,NOT,NONE,NONE
hasoc_en1_3866,Super excited to share a new addition to my family n life.. Delivered a baby boy.. Thanks for all ur wishes n support.. Wil b back in action soon..,NOT,NONE,NONE
hasoc_en_784,Trump Administration to Hold Migrant Children at Base That Served as WWII Japanese Internment Camp.  #trump #BorderCrisis #migration #Immigration     Repeating history huh? Are the #Jews next?   #ImpeachTrump #FakePresident #FakePOTUS #fucktrump,NOT,NONE,NONE
hasoc_en_356,A mandatory new course in karate and kungFu will be introduced in the MBBS course from the new session as a self defence to protect the doctors...#IMA #DoctorsFightBack,NOT,NONE,NONE
hasoc_en_3320,@pastorlocke UR FAKE PRESIDENT SUPPORTS ALL OF THE ABOVE #PROSTITUTES #ADULTERER #PUTTINGKIDSINCAGES #LYING #STEALING #CHEATING #RACIST #RAPIST #ABUSER #KKK this is the evangelical cr@p... all lies to makes huge $$$$$,NOT,NONE,NONE
hasoc_en_556,@thehill Projection Projection Projection.  PROJECTION PROJECTION PROJECTION PROJECTION PROJECTION PROJECTION PROJECTION PROJECTION PROJECTION PROJECTION PROJECTION PROJECTION PROJECTION PROJECTION PROJECTION PROJECTION #TrumpCrimeFamily #FuckTrump  #DerangedDonald #FeebleDonnie #FeebleDon,NOT,NONE,NONE
hasoc_en_230,"Stand by the doctors , with the doctors.   They need support and world needs to interfere .  #UNO #DoctorsProtest #DoctorsFightBack",NOT,NONE,NONE
hasoc_en_1340,New game...  How many dippin' sauces are in the pockets/purse of these two?  My guess?  47  #FuckTrump #SarahSanders https://t.co/CgoabRximn,NOT,NONE,NONE
hasoc_en_1430,"#Rangzen people, we have to stop this fake activist troll from ruining our #FreeTibet movement.     #Tibetans #humanrights #BoycottChina #Dharamsala #March10 #Tibetan #DalaiLama #BhoRangzen https://t.co/JHCJgBn4ZQ",NOT,NONE,NONE
hasoc_en_70,Throwback to the time when Pak dedicated an entire match to its army and the ICC didn't even flinch. India must not be pressured by ICC and change #Dhoni gloves. Don't let Pak win. Boycott the WC India!    #DhoniKeepTheGlove #DhoniKeepsTheGlove #DhoniKeSaathDesh #DhoniKeepTheGloves https://t.co/pcJdN21liN,NOT,NONE,NONE
hasoc_en_2501,@DiamondandSilk @realDonaldTrump Paid actors #ImpeachTrump #TrumpIsATraitor,NOT,NONE,NONE
hasoc_en_442,Bhakts are busy in giving Bad Rating to Zomato on Playstore  ,NOT,NONE,NONE
hasoc_en_4406,Send him to hell already..hahahahaha #ThethingsIseeonTwitter #FuckTrump #Hismomshouldofswallowed https://t.co/CS5suJ0WoO,NOT,NONE,NONE
hasoc_en_5240,When will we understand this thing that A #rapist has no religion they don’t care who the little girl is little #Aasifa or little #twinkleThey must be rewarded with capital punishment. It’s time to awake yourself.A girl should shouldn’t be judged by her religion #JusticeForTinkle https://t.co/XVcQ6XMC8r,NOT,NONE,NONE
hasoc_en_5720,"Hi @BorisJohnson, what a coincidence, the majority of Scottish people think that self-serving compulsive liars like yourself should not be allowed to be prime minister. #BorisJohnsonShouldNotBePM https://t.co/gDqO5O67lH",HOF,OFFN,TIN
hasoc_en_3560,"@realDonaldTrump Yeah, those hamberder’s won’t eat themselves and that TV won’t watch itself.    #LockTrumpUp  #ImpeachmentInquiryNow   #ImpeachTrump   #ImpeachBarr   #ImpeachMnuchin  #TrumpIsATraitor",NOT,NONE,NONE
hasoc_en_1759,Another snappy hashtag from @NSoames.    #SomebodyexplaintohimhowtheyworkforChristssake    #BorisJohnsonShouldNotBePM  #C4debate #Channel4Debate https://t.co/RVSnEmwDTX,NOT,NONE,NONE
hasoc_en_3149,so we wait 4 years just to see the rain in England. #ENGvWI #eng #ShameOnICC,HOF,HATE,TIN
hasoc_en_2772,Benny the Butcher... @BennyBsf #thealmightytour #bennythebutcher #griseldarecords #buffalo #beatsnbars #hiphop #rap #boogiedownbronx #bronx #bx #fuckaroundlayaround #fucktrump #fucklindafairstein @ Sony Hall https://t.co/q6q7eCGjeC,HOF,PRFN,TIN
hasoc_en_3820,I love this place @industrialeats #FuckTrump https://t.co/2Lxye53iVB,NOT,NONE,NONE
hasoc_en_402,"UK won't build a hard border, eu won't build a hard border, so who is?",NOT,NONE,NONE
hasoc_en_421,Of course. But he’s mad it all acceptable and normal! #FuckTrump,NOT,NONE,NONE
hasoc_en_1080,#ShameOnICC  @cricketworldcup #CWC19 had to be the best but due to the minor thoughts of @ICC it turned worst  @cricbuzz @BCCI can host the  tournaments best...  #ENGvsWI #WIvENG #CWC2019  Listen Michael Phelps claims the WC trophy coz he is best swimmer  @englandcricket shame on you,NOT,NONE,NONE
hasoc_en_492,Not even an elected representative is safe in BJPs Jharkhand ....  And they say law & order is an issue here ....,NOT,NONE,NONE
hasoc_en_1698,Yesterday match #AUSvWI Gayle got out by lbw in no ball..ICC @ICC Don't have time to fine umpires for poor umpiring. But they have time to say remove the balidan symbol from dhoni gloves😡😡 it's ridiculous 😡 #DhoniKeepsTheGlove https://t.co/8FMr3JHFqt,NOT,NONE,NONE
hasoc_en_3324,"Great Job ⁦@realDonaldTrump⁩ .  Too bad ⁦@BarackObama⁩ and ⁦@JohnKerry⁩ didn’t work out a successful plan to keep Iran from getting nuclear weapons before they left office....wait, they did.  #FuckTrump #DerangedDonald #ImpeachTrump https://t.co/e8MkRiby2s",NOT,NONE,NONE
hasoc_en_3425,"To all my fellow #Resisters followers and to those still out there, you guys/gals rock my socks off!!    #JohhMcCainDay   #FuckTrump  #ImpeachmentInquiryNow   #TheResistance    https://t.co/MtSD9ye5ng",HOF,OFFN,TIN
hasoc_en_1830,@WhiteHouse This is a seriously gross image especially on #JohnMcCainDay. #JohnMcCainisaHero #TrumpIsACoward #TrumpIsATraitor #JohnMcCainDayJune14th,NOT,NONE,NONE
hasoc_en_1003,We stand with @msdhoni infact #indiastandswithdhoni  #DhoniKeepsTheGlove   #IndiaStandsWithDhoni https://t.co/58GaSwrSuK,NOT,NONE,NONE
hasoc_en_4565,#ShameOnICC: Cricket fans worIdwide blast ICC after another World Cup washout @BCCI  @cricketworldcup @ICC  https://t.co/8EdZKjrRLY,NOT,NONE,NONE
hasoc_en_2579,"ये धोनी इंडिया के लिए खेलता है या @BCCI के लिए ?  #DhoniKeepsTheGlove , it's a nonsense hastag run by India , these players are puppet of #BCCI , unfortunately I too participated in this hastag . https://t.co/yn0zdvPtYZ https://t.co/L6Gkqm600I",NOT,NONE,NONE
hasoc_en_184,Like Seriously!!! This is what i literally tell my friends everyday!    #Health #water #hydrated #healthy #WorldBloodDonorDay #NBAFinals #FridayMotivation #FridayFeeling #ShameonICC #WeTheNorth #instagramdown #India #meme #SarcasmOnly https://t.co/t2FpSEY823,NOT,NONE,NONE
hasoc_en_918,People like Pandit Amit are making me go farther away from #Hinduism and closer to atheism. BTW I have already distanced myself from the #BJP that i once supported because of such chutiyes.   #IStandWithAmit   #Zomato   #India,HOF,PRFN,TIN
hasoc_en_5811,"@kayranmon And republicans compare this gold-digging 'I'll do anything to stay in this country' stripper to Jackie Onassis!  You are so right, some trashy shit. It's disgusting that Russians put this crap in the WH.  #cheater #conman #liar #scammer #divider #racist #sexualpredator #rapist",NOT,NONE,NONE
hasoc_en_146,No idea what this means but congrats on the sex,NOT,NONE,NONE
hasoc_en_1065,We Hold Scalpel To Operate And Cure  Not Guns To Treat Mankind Insecure    We Give Painkillers To Reduce Your Pain Not Wound To Make You Blood Stained We Cure Secure And Serve As True Nationalist   We Are Doctors Not Terrorists !   #DoctorsFightBack,NOT,NONE,NONE
hasoc_en_558,"Unfortunately it won’t happen, the two sides hate each other but like remainers and brexiteers.",NOT,NONE,NONE
hasoc_en_907,Boris what happened to your public entrances? Not avoiding anything now are you?,NOT,NONE,NONE
hasoc_en_853,Boris Johnson’s no-deal Brexit plan ‘will trigger early election’  Top Tories say attempt to appease hardliners means coalition of support for his leadership bid will not survive the autumn https://t.co/kFINjBsguY  #BorisJohnsonShouldNotBePM   #PutItToThePeople #SummerOfResistance,NOT,NONE,NONE
hasoc_en_4603,https://t.co/Hc06lcgMCM's Ali Catterall's take on it all ..    #BollockstoBrexit   #PeoplesVote   #BorisJohnsonShouldNotBePM https://t.co/0fdTYAqjXD,HOF,HATE,TIN
hasoc_en_1040,Please read &amp; Retweet so that this can reach to maximum people !     #Savethedoctors #SaveBengal #doctorsstrike #DoctorsFightBack https://t.co/4gm12uHeGm,NOT,NONE,NONE
hasoc_en_1962,"@cricketworldcup Experts(@ICC) told play World Cup in England, but I(Rain) have an other ideas 😂😅😜  @ECB_cricket   #ShameOnICC  #RainStopsMatch #SLvAUS #SAvAFG",NOT,NONE,NONE
hasoc_en_1770,@blondegoldbuyer @rissalipstick @MoishesMom It hasn’t ended💔💔💔‼️‼️‼️  Support @rissalipstick to finally put an end to the torture &amp; murder of #YulinFestival #EndDCMT #BoycottChina🇨🇳  &amp; do it NOW‼️ https://t.co/obMx8ZafRm,NOT,NONE,NONE
hasoc_en_3397,#fucktrump #trump2020  TRUMP IS A USELESS FUCKING IDIOT    HIS COMMENTS IN BIDEN HAVE NO VALUE    EXCLUSIVE: President Trump hits Joe Biden on policy flips: 'He has recalibrated on everything' - ABC News -  via @ABC https://t.co/EDwJ3dEZkq,HOF,PRFN,TIN
hasoc_en_5524,who the fuck puts milk on mashed potatoes pic.twitter.com/OfCQ8SJiFu,HOF,PRFN,UNT
hasoc_en_1047,Yesterday  Congress : blood donations are necessary blah blah blah   Today   Congress : snubbed on injustice on doctors in wb   Shame on u so called national opposition   #Thuuuuuuu #Congress #WestBengal #DoctorsFightBack #DoctorsProtest   #SoniaGandhi #RahulGandhi #priyankagandhi,HOF,HATE,TIN
hasoc_en_3581,"Hmmm, well then maybe he shouldn’t suck ass at EVERYTHING every single day. #TrumpIsACriminal #TrumpIsATraitor #TrumpIsTheEnemyOfThePeople #TrumpIsTheWorst #ImpeachTrumpNow #JohhMcCainDay https://t.co/21u6tm5QRk",HOF,PRFN,TIN
hasoc_en_3952,Wasn't that the point?   #TrumpIsATraitor https://t.co/B8bDDIhFGu,NOT,NONE,NONE
hasoc_en_706,"This Photoshoot Of A Hindu-Muslim, Same Sex Couple Proves That Love Has No Boundaries https://www.scoopwhoop.com/lgbt/photoshoot-hindu-muslim-same-sex-couple-love-has-no-boundaries/?ref=social&type=fb&b=0 …",NOT,NONE,NONE
hasoc_en_4044,@girlsreallyrule @write2bheard1 @GStephanopoulos He's such crook. Good on @GStephanopoulos for staying calm and not backing down. 'Little Wise Guy'. He sounds like the Mob Boss in 'Midnight Run'. #TrumpIsANationalSecurityThreat #TrumpIsATraitor,NOT,NONE,NONE
hasoc_en_4369,#WorldBloodDonorDay #FridayFeeling #ABrandNewDayOutNow  #ENGvWI #SaveBengal #ShameOnICC #BoyWithLuv18thWin #AmazonFashionXFossil #VOPE    Link: https://t.co/WWc1mZlONT https://t.co/yXJ0SnacpL,NOT,NONE,NONE
hasoc_en1_3437,"Congratulations to all those who took oath today. This team is a blend of youthful energy and administrative experience. It has people who have excelled as Parliamentarians and those who have had distinguished professional careers.     Together, we will work for India’s progress.",NOT,NONE,NONE
hasoc_en_4883,#bullshitboris lets get this trending #borisjohnson #BorisJohnsonShouldNotBePM https://t.co/dxSB3JDP4c,HOF,PRFN,TIN
hasoc_en_1182,@nealxg This is an insult to real Americans!! #TrumpSupportersarestupid #trumpisatraitor #trumpisaliar #TrumpIsAMoron #fucktrump,NOT,NONE,NONE
hasoc_en_2716,@rayleengale #Vote     #StrongerTogether     #LoveIsLove and of course .....     #FuckTrump #BlueSenate2020     💙,HOF,PRFN,TIN
hasoc_en_350,"Mum on Matt Hancock supporting Boris Johnson    ''I'm not angry, I'm just very disappointed'' #borisjohnson #BorisJohnsonShouldNotBePM #ToryLeadeshipContest #Conservatives",NOT,NONE,NONE
hasoc_en_4801,@realDonaldTrump happy birthday  hope you enjoy your day !   Because this is going to be your last as a Free Man ..  #TrumpIsATraitor  Jail time is waiting for you !  #LockHimUp,NOT,NONE,NONE
hasoc_en_4695,Pic 1:- Indian grounds    pic 2:- Others grounds    #ShameOnICC #INDvNZ #CWC19   @cricketaakash @sachin_rt @virendersehwag @AjitKum20724349 https://t.co/qZ0DEMlONz,HOF,HATE,TIN
hasoc_en_977,A billion Cricket fans waited four years to watch how it rains in England #ShameOnICC @ICC @BCCI #CWC19 https://t.co/hhGMF2CMKY,NOT,NONE,NONE
hasoc_en_329,look at it @ICC its our indore... #CWC19 #ShameOnICC https://t.co/UyjL3kaQxk,NOT,NONE,NONE
hasoc_en_2567,@MorajkarVibhuti @PFantta But what's the fault of the innocent familles who came for the treatment. They didn't beaten up anyone. They just seeking for the treatment of their problems. i am medical student too and I'm not against this movement but i think that's not the proper way.   #DoctorsFightBack,NOT,NONE,NONE
hasoc_en_1826,@pinklionheart @USArmy Just goes to show the HATE and VILE comments on Twitter.    Anti-American Left Wing Nuts ......    #JohnMcCainDay   #Traitor    #Treason   #Murderer https://t.co/4p6LSe2VaB,NOT,NONE,NONE
hasoc_en_2440,Trump did it again!!  Iran leadership doesnt understand the words nice and compassion... Donald is soooo funny!  ,NOT,NONE,NONE
hasoc_en_4606,@GovHowardDean #JackieO was an American treasure who inspired millions of Americans and made us proud. Melania is a Russian whore. #Putin's left over.   #TrumpIsATraitor  #JohnMcCainDayJune14  @FLOTUS https://t.co/HxTEMF4Xx8,HOF,HATE,TIN
hasoc_en1_3057,For those who disbelieved #IndianArmy @PMOIndia claim about #BalakotAirStrike and wanted more details     @MamataOfficial @OmarAbdullah     BALAKOT: MORE DETAILS REVEALED,NOT,NONE,NONE
hasoc_en1_1461,"Chandigarh: A girl attacks a man with a rod near Tribune Chowk after their cars rammed into each other    What's use of all talk of Modi's woman empowerment, if they can't even allowed to do violence on streets ",NOT,NONE,NONE
hasoc_en_4898,"Icc have a objection on gloves but not this Pakistani show if you agree,  Retweet this as much as you can #PAKvSL     #doublestanders  #DhoniKeepsTheGlove https://t.co/ugQgLhHRS6",HOF,HATE,TIN
hasoc_en_93,Gabor nails it again. A voice of reason.  #BorisJohnsonShouldNotBePM https://t.co/OzkGK5vL7n,NOT,NONE,NONE
hasoc_en_206,Don’t dare offend Islam ....it’s a disgrace how they treated this man.,NOT,NONE,NONE
hasoc_en_5500,"Back a man with no morals, no clue and could not give a fuck about anyone. Sounds a stupid idea. pic.twitter.com/d8lBFYwp0E",HOF,PRFN,TIN
